{
  "id": "split_01",
  "grid": [
    ".........",
    ".FFFT....",
    "....FF...",
    "....F....",
    ".FFFFFFG.",
    "........."
  ],
  "start": [
    1,
    1
  ],
  "goal": [
    4,
    7
  ],
  "bridges": [],
  "switches": [
    {
      "id": "splitter",
      "cell": [
        1,
        4
      ],
      "type": "SPLIT",
      "effects": [],
      "destinations": [
        [
          4,
          1
        ],
        [
          2,
          5
        ]
      ]
    }
  ]
}
