{
  "id": "switch_01",
  "grid": [
    ".........",
    ".S.......",
    ".F.......",
    ".F.......",
    ".FFFFBBG.",
    "........."
  ],
  "start": [
    4,
    1
  ],
  "goal": [
    4,
    7
  ],
  "bridges": [
    {
      "id": "gate",
      "cells": [
        [
          4,
          5
        ],
        [
          4,
          6
        ]
      ],
      "initial_enabled": false
    }
  ],
  "switches": [
    {
      "id": "soft_gate",
      "cell": [
        1,
        1
      ],
      "type": "SOFT",
      "effects": [
        {
          "bridge_id": "gate",
          "operation": "TOGGLE"
        }
      ]
    }
  ]
}
