{
  "id": "combined_01",
  "grid": [
    "..........",
    "S.........",
    "F.........",
    "F.........",
    "FBBFOOXBBG",
    ".........."
  ],
  "start": [
    4,
    0
  ],
  "goal": [
    4,
    9
  ],
  "bridges": [
    {
      "id": "entry_gate",
      "cells": [
        [
          4,
          1
        ],
        [
          4,
          2
        ]
      ],
      "initial_enabled": false
    },
    {
      "id": "exit_gate",
      "cells": [
        [
          4,
          7
        ],
        [
          4,
          8
        ]
      ],
      "initial_enabled": false
    }
  ],
  "switches": [
    {
      "id": "soft_entry",
      "cell": [
        1,
        0
      ],
      "type": "SOFT",
      "effects": [
        {
          "bridge_id": "entry_gate",
          "operation": "TOGGLE"
        }
      ]
    },
    {
      "id": "heavy_exit",
      "cell": [
        4,
        6
      ],
      "type": "HEAVY",
      "effects": [
        {
          "bridge_id": "exit_gate",
          "operation": "SET_OPEN"
        }
      ]
    }
  ]
}
