{
  "id": "campaign_07",
  "grid": [
    "............",
    ".F.F....FFF.",
    ".FFF....FFF.",
    ".FFF....FFG.",
    ".FFFF..FFFF.",
    ".FFFF..FFFF.",
    ".FFFF..FFFF.",
    ".FFOOOOBFFF.",
    ".FFOOOOBFFF.",
    "............"
  ],
  "start": [
    4,
    1
  ],
  "goal": [
    3,
    10
  ],
  "bridges": [
    {
      "id": "cloud_walk",
      "cells": [
        [
          7,
          7
        ],
        [
          8,
          7
        ]
      ],
      "initial_enabled": true
    }
  ],
  "switches": [],
  "biomeId": "dusk"
}
