{
  "id": "campaign_19",
  "grid": [
    "..........",
    ".FFFT.....",
    "....FF....",
    "....F.....",
    ".FFFFFFFG.",
    ".......FF.",
    "..........",
    ".........."
  ],
  "start": [
    1,
    1
  ],
  "goal": [
    4,
    8
  ],
  "bridges": [],
  "switches": [
    {
      "id": "splitter",
      "cell": [
        1,
        4
      ],
      "type": "SPLIT",
      "effects": [],
      "destinations": [
        [
          4,
          1
        ],
        [
          2,
          5
        ]
      ]
    }
  ],
  "biomeId": "cavern"
}
